MeterID,Description,Units,Resource,BuildingID,BuildingName,GrossSquareFeet,BuildDate,Latitude,Longitude,Campus,Organization,LocationType,SteamSourceID,ChilledWaterSourceID,HotWaterSourceID
OSU_RTS.MDBUS_C1.001_HF,BRICKER CW HEAT FLOW,KBTU/HR,Chilled Water ,1,"Bricker, John W, Hall",74140.0,1924-07-01,40.00063,-83.01339,Main,ADM,Administration,69,69,69
OSU_RTS.MDBUS_RT.001S_HF,BRICKER ST HEAT FLOW,KBTU/HR,Steam,1,"Bricker, John W, Hall",74140.0,1924-07-01,40.00063,-83.01339,Main,ADM,Administration,69,69,69
OSU_RTS.MDBUS_RT.102S_HF,OXLEY STM HEAT FLOW,KBTU/HR,Steam,102,Oxley Hall,31148.0,1908-07-01,39.99655,-83.0144,Main,ACA,Academic,105,105,105
OSU_RTS.MDBUS_RT.105S_HF,KENNEDY STM HEAT FLOW,KBTU/HR,Steam,105,"Kennedy, June F, Commons",36868.0,1939-07-01,39.99659,-83.01399,Main,SDL,Student Housing,69,69,69
OSU_RTS.MDBUS_RT.106S_HF,SULLIVANT STM HEAT FLOW,KBTU/HR,Steam,106,"Sullivant, Joseph, Hall",135883.0,1913-07-01,39.99945,-83.00875,Main,ACA,Academic,69,69,69
OSU_RTS.MDBUS_RT.107S_HF,WATTS ST HEAT FLOW,KBTU/HR,Steam,107,Watts Hall,35504.0,1955-07-01,40.00347,-83.01126,Main,ACA,Academic/Research,69,69,69
OSU_RTS.MDBUS_H1.011_HHF,ARPS HW HEAT FLOW,KBTU/HR,Heating Hot Water,11,"Arps, George F, Hall",129371.0,1925-07-01,40.00193,-83.00947,Main,ACA,Academic,69,69,69
OSU_RTS.MDBUS_RH.1101_HHF,TORRES HW HEAT FLOW,KBTU/HR,Heating Hot Water,1101,Torres House,127073.0,2015-07-01,40.00595,-83.01366,Main,SDL,Student Housing,,,
OSU_RTS.MDBUS_RH.1101_HF,TORRES HW HEAT FLOW,KBTU/HR,Chilled Water ,1101,Torres House,127073.0,2015-07-01,40.00595,-83.01366,Main,SDL,Student Housing,,,
OSU_RTS.MDBUS_RH.1102_HHF,HOUSTON HW HEAT FLOW,KBTU/HR,Heating Hot Water,1102,Houston House,136557.0,2016-07-01,40.00581,-83.01166,Main,SDL,Student Housing,,,
OSU_RTS.MDBUS_RH.1102C_HF,HOUSTON CW HEAT FLOW,KBTU/HR,Chilled Water ,1102,Houston House,136557.0,2016-07-01,40.00581,-83.01166,Main,SDL,Student Housing,,,
OSU_RTS.MDBUS_RH.1103_HHF,RANEY HW HEAT FLOW,KBTU/HR,Heating Hot Water,1103,Raney House,125474.0,2015-07-01,40.00547,-83.01003,Main,SDL,Student Housing,,,
OSU_RTS.MDBUS_RH.1103C_HF,RANEY CW HEAT FLOW,KBTU/HR,Chilled Water ,1103,Raney House,125474.0,2015-07-01,40.00547,-83.01003,Main,SDL,Student Housing,,,
OSU_RTS.MDBUS_RH.1104_HHF,BOWEN HW HEAT FLOW,KBTU/HR,Heating Hot Water,1104,Bowen House,95448.0,2015-07-01,40.00536,-83.00942,Main,SDL,Student Housing,,,
OSU_RTS.MDBUS_RH.1104C_HF,BOWEN CW HEAT FLOW,KBTU/HR,Chilled Water ,1104,Bowen House,95448.0,2015-07-01,40.00536,-83.00942,Main,SDL,Student Housing,,,
OSU_RTS.MDBUS_RH.1105_HHF,BUSCH HW HEAT FLOW,KBTU/HR,Heating Hot Water,1105,Busch House,109926.0,2016-07-01,40.00475,-83.0093,Main,SDL,Student Housing,,,
OSU_RTS.MDBUS_RH.1105C_HF,BUSCH CW HEAT FLOW,KBTU/HR,Chilled Water ,1105,Busch House,109926.0,2016-07-01,40.00475,-83.0093,Main,SDL,Student Housing,,,
OSU_RTS.MDBUS_RH.1106_HHF,CURL HW HEAT FLOW,KBTU/HR,Heating Hot Water,1106,Curl Hall,25653.0,2015-07-01,40.00428,-83.01095,Main,SDL,Student Housing,,,
OSU_RTS.MDBUS_RH.1106C_HF,CURL CW HEAT FLOW,KBTU/HR,Chilled Water ,1106,Curl Hall,25653.0,2015-07-01,40.00428,-83.01095,Main,SDL,Student Housing,,,
OSU_RTS.MDBUS_RH.1107_HHF,BLACKBURN HW HEAT FLOW,KBTU/HR,Heating Hot Water,1107,Blackburn House,132162.0,2016-07-01,40.00412,-83.01256,Main,SDL,Student Housing,,,
OSU_RTS.MDBUS_RH.1107C_HF,BLACKBURN CW HEAT FLOW,KBTU/HR,Chilled Water ,1107,Blackburn House,132162.0,2016-07-01,40.00412,-83.01256,Main,SDL,Student Housing,,,
OSU_RTS.MDBUS_RH.1108_HHF,SCOTT HHW HEAT FLOW,KBTU/HR,Heating Hot Water,1108,Scott House,169311.0,2015-07-01,40.00439,-83.01339,Main,SDL,Student Housing,,,
OSU_RTS.MDBUS_RH.1108C_HF,SCOTT CW HEAT FLOW,KBTU/HR,Chilled Water ,1108,Scott House,169311.0,2015-07-01,40.00439,-83.01339,Main,SDL,Student Housing,,,
OSU_RTS.MDBUS_RH.1109_HHF,N. REC HW HEAT FLOW,KBTU/HR,Heating Hot Water,1109,North Recreation Center,28834.0,2016-07-01,,,Main,SDL,Student Activity,,,
OSU_RTS.MDBUS_RH.1109C_HF,NORTH REC CW HEAT FLOW,KBTU/HR,Chilled Water ,1109,North Recreation Center,28834.0,2016-07-01,,,Main,SDL,Student Activity,,,
OSU_RTS.MDBUS_RH.1110_HHF,NOSKER HHW HEAT FLOW,KBTU/HR,Heating Hot Water,1110,Nosker House,106857.0,2016-07-01,40.00485,-83.01211,Main,SDL,Student Housing,,,
OSU_RTS.MDBUS_RH.1110C_HF,NOSKER CW HEAT FLOW,KBTU/HR,Chilled Water ,1110,Nosker House,106857.0,2016-07-01,40.00485,-83.01211,Main,SDL,Student Housing,,,
OSU_RTS.MDBUS_RT.112S_HF,BRT STM HEAT FLOW,KBTU/HR,Steam,112,Biomedical Research Tower,412630.0,2006-12-01,,,Medical Center,,Research,69,69,69
OSU_RTS.MDBUS_C1.127_HF,SMITH SUB CW HEAT FLOW,KBTU/HR,Chilled Water ,127,"Smith, Thomas, Electrical Substation",23886.0,2005-07-01,0.0,0.0,Main,SUB,Facilities,,,
OSU_RTS.MDBUS_C1.136_HF,VMA CW HEAT FLOW,KBTU/HR,Chilled Water ,136,Veterinary Medicine Academic,113459.0,2002-07-01,39.99953,-83.02661,Main,ACA,Academic,69,69,69
OSU_RTS.MDBUS_RT.014S_HF,JENNINGS STM HEAT FLOW,KBTU/HR,Steam,14,"Jennings, Edward H, Hall",112502.0,1914-07-01,39.99674,-83.01565,Main,ACA,Academic/Research,69,69,69
OSU_RTS.MDBUS_C1.144_CHF,PSYCH CW HEAT FLOW,KBTU/HR,Chilled Water ,144,Psychology Building,132733.0,2005-07-01,39.99852,-83.01627,Main,ACA,Academic,69,69,69
OSU_RTS.MDBUS_RT.144S_HF,PSYCH STM HEAT FLOW,KBTU/HR,Steam,144,Psychology Building,132733.0,2005-07-01,39.99852,-83.01627,Main,ACA,Academic,69,69,69
OSU_RTS.MDBUS_C1.146A_CHF,BOLZ CW HEAT FLOW,KBTU/HR,Chilled Water ,146,"Bolz, Harold A, Hall",82179.0,1960-07-01,40.0031,-83.01502,Main,ACA,Academic,69,69,69
OSU_RTS.MDBUS_RT.146S_HF,BOLZ STM HEAT FLOW,KBTU/HR,Steam,146,"Bolz, Harold A, Hall",82179.0,1960-07-01,40.0031,-83.01502,Main,ACA,Academic,69,69,69
OSU_RTS.MDBUS_C1.146_HF,BOLZ/HITCH CW HEAT FLOW,KBTU/HR,Chilled Water ,146,"Bolz, Harold A, Hall",82179.0,1960-07-01,40.0031,-83.01502,Main,ACA,Academic,69,69,69
OSU_RTS.MDBUS_C1.147_HF,NEWMAN CW HEAT FLOW,KBTU/HR,Chilled Water ,147,Newman and Wolfrom Laboratory of Chemistry,62058.0,1995-07-01,40.00238,-83.01137,Main,ACA,Lab,69,69,69
OSU_RTS.MDBUS_RT.147S_HF,NEWMAN WOLF ST HEAT FLOW,KBTU/HR,Steam,147,Newman and Wolfrom Laboratory of Chemistry,62058.0,1995-07-01,40.00238,-83.01137,Main,ACA,Lab,69,69,69
OSU_RTS.MDBUS_C1.148_HF,SCOTT CW HEAT FLOW,KBTU/HR,Chilled Water ,148,"Scott, Peter L and Clara M, Laboratory",262375.0,2006-07-01,40.00231,-83.01418,Main,ACA,Academic/Research,69,69,69
OSU_RTS.MDBUS_RT.148S_HF,SCOTT LAB STM HEAT FLOW,KBTU/HR,Steam,148,"Scott, Peter L and Clara M, Laboratory",262375.0,2006-07-01,40.00231,-83.01418,Main,ACA,Academic/Research,69,69,69
OSU_RTS.MDBUS_RT.149S_HF,HOPKINS STM HEAT FLOW,KBTU/HR,Steam,149,"Hopkins, James R, Hall",110154.0,1959-07-01,40.00087,-83.01155,Main,ACA,Academic,69,69,69
OSU_RTS.MDBUS_RT.150_HF,EVANS LAB ST HEAT FLOW,KBTU/HR,Steam,150,"Evans, William Lloyd, Laboratory",117574.0,1960-07-01,40.00266,-83.0111,Main,,OSUWMC,69,69,69
OSU_RTS.MDBUS_C1.150_HF,EVANS LAB CW HEAT FLOW,KBTU/HR,Chilled Water ,150,"Evans, William Lloyd, Laboratory",117574.0,1960-07-01,40.00266,-83.0111,Main,,OSUWMC,69,69,69
OSU_RTS.MDBUS_C1.160_HF,SAS CW HEAT FLOW,KBTU/HR,Chilled Water ,160,Student Academic Services Building,137250.0,2010-07-01,40.00601,-83.01613,Main,ADM,Office,69,69,69
OSU_RTS.MDBUS_RT.160S_HF,SAS STM HEAT FLOW,KBTU/HR,Steam,160,Student Academic Services Building,137250.0,2010-07-01,40.00601,-83.01613,Main,ADM,Office,69,69,69
OSU_RTS.MDBUS_RT.161S_HF,OHIO UNION HEAT FLOW,KBTU/HR,Steam,161,Ohio Union,317694.0,2010-07-01,39.99766,-83.00864,Main,SDL,Student Housing,69,69,69
OSU_RTS.MDBUS_RT.163S_HF,TZAGOURNIS STM HEAT FLOW,KBTU/HR,Steam,163,"Tzagournis, Manuel, Medical Research Facilty",80417.0,1994-10-01,,,Medical Center,ACA,Academic/Research,69,69,69
OSU_RTS.MDBUS_C1.017_HF,KNOWLTON CW HEAT FLOW,KBTU/HR,Chilled Water ,17,"Knowlton, Austin E, Hall",174422.0,2004-07-01,40.0036,-83.01679,Main,ACA,Academic,69,69,69
OSU_RTS.MDBUS_RT.017S_HF,KNOWTON STM HEAT FLOW,KBTU/HR,Steam,17,"Knowlton, Austin E, Hall",174422.0,2004-07-01,40.0036,-83.01679,Main,ACA,Academic,69,69,69
OSU_RTS.MDBUS_RT.176S_HF,STAR/LOVE ST HEAT FLOW,KBTU/HR,Steam,176,Starling Loving Hall,149403.0,1917-06-01,39.99493,-83.01602,Medical Center,ACA,Academic/Research,69,69,69
OSU_RTS.MDBUS_C1.018_HF,CAMPBELL CW HEAT FLOW,KBTU/HR,Chilled Water ,18,"Campbell, Elizabeth Owens, Hall",115368.0,1916-07-01,39.99776,-83.01582,Main,ACA,Academic,69,69,69
OSU_RTS.MDBUS_RT.018S_HF,CAMPBELL STM HEAT FLOW,KBTU/HR,Steam,18,"Campbell, Elizabeth Owens, Hall",115368.0,1916-07-01,39.99776,-83.01582,Main,ACA,Academic,69,69,69
OSU_RTS.MDBUS_C1.180_HF,GOSS CW HEAT FLOW,KBTU/HR,Chilled Water ,180,"Goss, Leonard W, Laboratory",67943.0,1962-07-01,40.0,-83.02755,Main,ACA,Academic/Research,69,69,69
OSU_RTS.MDBUS_C1.180B_HF,GOSS BYPASS CW HEAT FLOW,KBTU/HR,Chilled Water ,180,"Goss, Leonard W, Laboratory",67943.0,1962-07-01,40.0,-83.02755,Main,ACA,Academic/Research,69,69,69
OSU_RTS.MDBUS_H1.187_HHF,MATH BLD HW HEAT FLOW,KBTU/HR,Heating Hot Water,187,Mathematics Building,28893.0,1962-07-01,40.00148,-83.01476,Main,ACA,Academic,69,69,69
OSU_RTS.MDBUS_C1.187_HF,MATH BLDG CW HEAT FLOW,KBTU/HR,Chilled Water ,187,Mathematics Building,28893.0,1962-07-01,40.00148,-83.01476,Main,ACA,Academic,69,69,69
OSU_RTS.MDBUS_RT.229S_HF,ICE RINK STM HEAT FLOW,KBTU/HR,Steam,229,Ice Rink,34005.0,1961-07-01,,,Main,ATH,Athletics,69,69,69
OSU_RTS.MDBUS_C1.246_3HF,PAES CW HEAT FLOW,KBTU/HR,Chilled Water ,245,Physical Activity and Education Services - PAES,163899.0,2007-07-01,39.99983,-83.01724,Main,ACA,Academic,,,
OSU_RTS.MDBUS_RT.245S_HF,PAES ST HEAT FLOW,KBTU/HR,Steam,245,Physical Activity and Education Services - PAES,163899.0,2007-07-01,39.99983,-83.01724,Main,ACA,Academic,,,
OSU_RTS.MDBUS_H1.246_15HF,PAES HW HEAT FLOW,KBTU/HR,Heating Hot Water,245,Physical Activity and Education Services - PAES,163899.0,2007-07-01,39.99983,-83.01724,Main,ACA,Academic,,,
OSU_RTS.MDBUS_CC.246_4HF,RPAC CALC CW HEAT FLOW,KBTU/HR,Chilled Water ,246,Recreation and Physical Activity Center,279848.0,2005-07-01,39.99951,-83.01838,Main,SDL,Student Housing,69,69,69
OSU_RTS.MDBUS_C1.246_2HF,RPAC M2 CW HEAT FLOW,KBTU/HR,Chilled Water ,246,Recreation and Physical Activity Center,279848.0,2005-07-01,39.99951,-83.01838,Main,SDL,Student Housing,69,69,69
OSU_RTS.MDBUS_H1.246_H4HF,RPAC M4 HW HEAT FLOW,KBTU/HR,Heating Hot Water,246,Recreation and Physical Activity Center,279848.0,2005-07-01,39.99951,-83.01838,Main,SDL,Student Housing,69,69,69
OSU_RTS.MDBUS_H1.246_H5HF,RPAC M5 HW HEAT FLOW,KBTU/HR,Heating Hot Water,246,Recreation and Physical Activity Center,279848.0,2005-07-01,39.99951,-83.01838,Main,SDL,Student Housing,69,69,69
OSU_RTS.MDBUS_H1.246_H6HF,RPAC M6 HW HEAT FLOW,KBTU/HR,Heating Hot Water,246,Recreation and Physical Activity Center,279848.0,2005-07-01,39.99951,-83.01838,Main,SDL,Student Housing,69,69,69
OSU_RTS.MDBUS_RT.246S_HF,RPAC STM HEAT FLOW,KBTU/HR,Steam,246,Recreation and Physical Activity Center,279848.0,2005-07-01,39.99951,-83.01838,Main,SDL,Student Housing,69,69,69
OSU_RTS.MDBUS_H1.247_H2HF,MCCORKLE DP HW HEAT FLOW,KBTU/HR,Heating Hot Water,247,McCorkle Aquatic Pavilion,127491.0,2005-07-01,39.99838,-83.01793,Main,ATH,Athletics,,,
OSU_RTS.MDBUS_H1.247_H3HF,MCCORKLE SPA HW HEAT FLO,KBTU/HR,Heating Hot Water,247,McCorkle Aquatic Pavilion,127491.0,2005-07-01,39.99838,-83.01793,Main,ATH,Athletics,,,
OSU_RTS.MDBUS_H1.247_HHF,MCCORKLE CP HW HEAT FLOW,KBTU/HR,Heating Hot Water,247,McCorkle Aquatic Pavilion,127491.0,2005-07-01,39.99838,-83.01793,Main,ATH,Athletics,,,
OSU_RTS.MDBUS_RT.248S_HF,CBEC STM HEAT FLOW,KBTU/HR,Steam,248,Chemical and Biomolecular Engineering and Chemistry Building,236537.0,2014-07-01,40.00342,-83.0134,Main,ACA,Academic/Research,69,69,69
OSU_RTS.MDBUS_C1.248_HF,CBEC CW HEAT FLOW,KBTU/HR,Chilled Water ,248,Chemical and Biomolecular Engineering and Chemistry Building,236537.0,2014-07-01,40.00342,-83.0134,Main,ACA,Academic/Research,69,69,69
OSU_RTS.MDBUS_C1.249_HF,FISHER CW HEAT FLOW,KBTU/HR,Chilled Water ,249,"Fisher, Max M, Hall",132056.0,1998-07-01,,,Main,ADM,Administration,69,69,69
OSU_RTS.MDBUS_C1.025_HF,DERBY CW HEAT FLOW,KBTU/HR,Chilled Water ,25,Derby Hall,115334.0,1906-07-01,40.00076,-83.01243,Main,ACA,Academic/Administration,69,69,69
OSU_RTS.MDBUS_RT.025S_HF,DERBY STM HEAT FLOW,KBTU/HR,Steam,25,Derby Hall,115334.0,1906-07-01,40.00076,-83.01243,Main,ACA,Academic/Administration,69,69,69
OSU_RTS.MDBUS_C1.251_HF,SCHOENBAUM CW HEAT FLOW,KBTU/HR,Chilled Water ,251,Schoenbaum Undergrad Program Bldg,62748.0,1999-07-01,40.00433,-83.01475,Main,ACA,Academic/Administration,69,69,69
OSU_RTS.MDBUS_RT.251S_HF,SCHOENBAUM STM HEAT FLOW,KBTU/HR,Steam,251,Schoenbaum Undergrad Program Bldg,62748.0,1999-07-01,40.00433,-83.01475,Main,ACA,Academic/Administration,69,69,69
OSU_RTS.MDBUS_C1.252_HF,MASON CW HEAT FLOW,KBTU/HR,Chilled Water ,252,"Mason, Raymond E, Hall",68150.0,1999-07-01,40.0044,-83.01547,Main,ACA,Academic,69,69,69
OSU_RTS.MDBUS_RT.252S_HF,MASON STM HEAT FLOW,KBTU/HR,Steam,252,"Mason, Raymond E, Hall",68150.0,1999-07-01,40.0044,-83.01547,Main,ACA,Academic,69,69,69
OSU_RTS.MDBUS_RT.254S_HF,BLACKWELL STM HEAT FLOW,KBTU/HR,Steam,254,Blackwell Inn,127992.0,2002-07-01,40.00483,-83.01661,Main,SDL,Hotel,69,69,69
OSU_RTS.MDBUS_C1.254C_HF,BLACKWELL CW HEAT FLOW,KBTU/HR,Chilled Water ,254,Blackwell Inn,127992.0,2002-07-01,40.00483,-83.01661,Main,SDL,Hotel,69,69,69
OSU_RTS.MDBUS_RT.259S21HF,12TH AVE EAST ST HEAT FL,KBTU/HR,Steam,259,"HALE HALL, FRANK W. JR.",26855.0,1964-06-01,,,,,,,,
OSU_RTS.MDBUS_RT.259S22HF,12TH AVE WEST HEAT FLOW,KBTU/HR,Steam,259,"HALE HALL, FRANK W. JR.",26855.0,1964-06-01,,,,,,,,
OSU_RTS.MDBUS_RT.259S_HF,HALE HALL ST HEAT FLOW,KBTU/HR,Steam,259,"HALE HALL, FRANK W. JR.",26855.0,1964-06-01,,,,,,,,
OSU_RTS.MDBUS_C1.026_HF,CALDWELL CW HEAT FLOW,KBTU/HR,Chilled Water ,26,Caldwell Laboratory,100348.0,1950-07-01,40.00243,-83.01503,Main,ACA,Academic/Research,69,69,69
OSU_RTS.MDBUS_C1.266_2HF,RIFFE CW02 HEAT FLOW,KBTU/HR,Chilled Water ,266,"Riffe, Vernal G, Jr, Building",130130.0,1994-07-01,39.99674,-83.02044,Main,ACA,Lab,69,69,69
OSU_RTS.MDBUS_C1.266_HF,RIFFE CW01 HEAT FLOW,KBTU/HR,Chilled Water ,266,"Riffe, Vernal G, Jr, Building",130130.0,1994-07-01,39.99674,-83.02044,Main,ACA,Lab,69,69,69
OSU_RTS.MDBUS_RT.266S_HF,RIFFE ST HEAT FLOW,KBTU/HR,Steam,266,"Riffe, Vernal G, Jr, Building",130130.0,1994-07-01,39.99674,-83.02044,Main,ACA,Lab,69,69,69
OSU_RTS.MDBUS_RT.272SK_HF,MORRILL KIT.STM.HEAT FLO,KBTU/HR,Steam,272,"Morrill, Justin S, Tower",324139.0,1967-07-01,40.00004,-83.02188,Main,SDL,Student Housing,69,69,69
OSU_RTS.MDBUS_RT.273S_HF,PARK STM HEAT FLOW,KBTU/HR,Steam,273,"Parks, Lloyd M, Hall",119237.0,1967-07-01,39.99638,-83.02094,Main,ACA,Academic/Research,69,69,69
OSU_RTS.MDBUS_CC.274C_HF,HITCHCOCK CW HEAT FLOW,KBTU/HR,Chilled Water ,274,Hitchcock Hall,118612.0,1967-07-01,40.00357,-83.01528,Main,ACA,Academic,69,69,69
OSU_RTS.MDBUS_RT.274S_HF,HITCHCOCK HALL ST HT FLO,KBTU/HR,Steam,274,Hitchcock Hall,118612.0,1967-07-01,40.00357,-83.01528,Main,ACA,Academic,69,69,69
OSU_RTS.MDBUS_RT.272S_HF,MORRILL STM HEAT FLOW,KBTU/HR,Steam,275,"Newton, Mildred E, Hall",80833.0,1968-07-01,,,Main,ACA,Academic/Research,69,69,69
OSU_RTS.MDBUS_RT.275S_HF,NEWTON STM HEAT FLOW,KBTU/HR,Steam,275,"Newton, Mildred E, Hall",80833.0,1968-07-01,,,Main,ACA,Academic/Research,69,69,69
OSU_RTS.MDBUS_RT.276S_HF,BIOSCI STM HEAT FLOW,KBTU/HR,Steam,276,Biological Science Building,180694.0,1970-07-01,39.9965,-83.02008,Main,ACA,Academic/Research,69,69,69
OSU_RTS.MDBUS_C1.276_HF,BIOSCI CW HEAT FLOW,KBTU/HR,Chilled Water ,276,Biological Science Building,180694.0,1970-07-01,39.9965,-83.02008,Main,ACA,Academic/Research,69,69,69
OSU_RTS.MDBUS_RT.279S_HF,DREESE STM HEAT FLOW,KBTU/HR,Steam,279,"Dreese Laboratories, Erwin E",185430.0,1969-07-01,40.00222,-83.01599,Main,ACA,Academic,69,69,69
OSU_RTS.MDBUS_C1.279_HF,DREESE CW HEAT FLOW,KBTU/HR,Chilled Water ,279,"Dreese Laboratories, Erwin E",185430.0,1969-07-01,40.00222,-83.01599,Main,ACA,Academic,69,69,69
OSU_RTS.MDBUS_C1.280B_HF,BAKER BMNT CW HEAT FLOW,KBTU/HR,Chilled Water ,280,"Baker, David F, Systems Engineering Building (The)",114930.0,1968-07-01,40.0016,-83.01592,Main,ACA,Academic,69,69,69
OSU_RTS.MDBUS_C1.280P_HF,BAKER PENT CW HEAT FLOW,KBTU/HR,Chilled Water ,280,"Baker, David F, Systems Engineering Building (The)",114930.0,1968-07-01,40.0016,-83.01592,Main,ACA,Academic,69,69,69
OSU_RTS.MDBUS_RT.280S_HF,BAKER SYS STM HEAT FLOW,KBTU/HR,Steam,280,"Baker, David F, Systems Engineering Building (The)",114930.0,1968-07-01,40.0016,-83.01592,Main,ACA,Academic,69,69,69
OSU_RTS.MDBUS_C1.282_HF,EQUINE CW HEAT FLOW,KBTU/HR,Chilled Water ,282,"Galbreath, Daniel M, Equine Center",40822.0,1996-07-01,40.0012,-83.0287,Main,ACA,Veterinary,69,69,69
OSU_RTS.MDBUS_H1.293_HHF1,CUNZ HW HEAT FLOW,KBTU/HR,Heating Hot Water,293,"Cunz, Dieter, Hall",68100.0,1969-07-01,39.99866,-83.01704,Main,ACA,Academic,69,69,69
OSU_RTS.MDBUS_C1.293_HF,CUNZ CW HEAT FLOW,KBTU/HR,Chilled Water ,293,"Cunz, Dieter, Hall",68100.0,1969-07-01,39.99866,-83.01704,Main,ACA,Academic,69,69,69
OSU_RTS.MDBUS_RT.293S_HF,CUNZ ST HEAT FLOW,KBTU/HR,Steam,293,"Cunz, Dieter, Hall",68100.0,1969-07-01,39.99866,-83.01704,Main,ACA,Academic,69,69,69
OSU_RTS.MDBUS_RT.296S_HF,DRAKE STM HEAT FLOW,KBTU/HR,Steam,296,Drake Performance and Event Center,115835.0,1972-07-01,39.99929,-83.02314,Main,ACA,Academic,69,69,69
OSU_RTS.MDBUS_RT.298S_HF,AG ENGIN STM HEAT FLOW,KBTU/HR,Steam,298,Agricultural Engineering Building,120345.0,1987-07-01,40.00552,-83.02498,Main,ACA,Agricultural,69,69,69
OSU_RTS.MDBUS_C1.299_HF,VET HOSP CW HEAT FLOW,KBTU/HR,Chilled Water ,299,Veterinary Medical Center,222496.0,1973-07-01,40.00087,-83.02768,Main,ACA,Veterinary,299,299,299
OSU_RTS.MDBUS_RT.299S_HF,VET HOSP STM HEAT FLOW,KBTU/HR,Steam,299,Veterinary Medical Center,222496.0,1973-07-01,40.00087,-83.02768,Main,ACA,Veterinary,299,299,299
OSU_RTS.MDBUS_RT.003S_HF,AG ADMIN STM HEAT FLOW,KBTU/HR,Steam,3,Agricultural Administration Building,100228.0,1956-07-01,40.00543,-83.02723,Main,ACA,Academic/Administration,69,69,69
OSU_RTS.MDBUS_H1.030_HHF,DENNEY HW HEAT FLOW,KBTU/HR,Heating Hot Water,30,"Denney, Joseph Villiers, Hall",103770.0,1960-07-01,40.00131,-83.01253,Main,ACA,Academic,,,
OSU_RTS.MDBUS_RT.302S_HF,PRIOR STM HEAT FLOW,KBTU/HR,Steam,302,"Prior, John A, Hall",147486.0,1973-04-01,,,Medical Center,ACA,Academic,69,69,69
OSU_RTS.MDBUS_C1.337_HF,DULLES CW HEAT FLOW,KBTU/HR,Chilled Water ,337,"Dulles, Foster Rhea, Hall",41284.0,1974-07-01,40.00111,-83.01441,Main,ACA,Academic,,,
OSU_RTS.MDBUS_C1.338_HF,INDEPEND CW HEAT FLOW,KBTU/HR,Chilled Water ,338,Independence Hall,15891.0,1975-07-01,40.00036,-83.01576,Main,ACA,Academic,69,69,69
OSU_RTS.MDBUS_H1.339_HHF,UHALL HW HEAT FLOW,KBTU/HR,Heating Hot Water,339,University Hall,77845.0,1976-07-01,40.00052,-83.01443,Main,ACA,Academic,,,
OSU_RTS.MDBUS_C1.339_HF,U-HALL CW HEAT FLOW,KBTU/HR,Chilled Water ,339,University Hall,77845.0,1976-07-01,40.00052,-83.01443,Main,ACA,Academic,,,
OSU_RTS.MDBUS_RT.340S_HF,KOTTMAN STM HEAT FLOW,KBTU/HR,Steam,340,"Kottman, Roy M, Hall",167040.0,1981-07-01,40.00266,-83.02684,Main,ACA,Academic,69,69,69
OSU_RTS.MDBUS_C1.353_HF,ROSS CW HEAT FLOW,KBTU/HR,Chilled Water ,353,Ross Heart Hospital,306801.0,2004-11-01,,,Medical Center,,Patient Care,69,69,69
OSU_RTS.MDBUS_C1.354_HF,RHODES CW HEAT FLOW,KBTU/HR,Chilled Water ,354,"Rhodes, James A, Hall",507803.0,1979-06-01,,,Medical Center,,Patient Care,69,69,69
OSU_RTS.MDBUS_H1.355_HHF,WEIGEL HALL HW HEAT FLOW,KBTU/HR,Heating Hot Water,355,"Weigel, Eugene J, Hall",47042.0,1979-07-01,40.00069,-83.00983,Main,ACA,Academic,,,
OSU_RTS.MDBUS_RT.356S_HF,395 W.12TH STM HEAT FLOW,KBTU/HR,Steam,356,"Twelfth Ave, 395 W",90747.0,1961-01-01,,,Medical Center,,Administration,69,69,69
OSU_RTS.MDBUS_RT.037S_HF,HAGERTY HALL ST HT FLOW,KBTU/HR,Steam,37,Hagerty Hall,142496.0,1924-07-01,39.99861,-83.01031,Main,ACA,Academic,69,69,69
OSU_RTS.MDBUS_C1.371_HF,CELESTE CW HEAT FLOW,KBTU/HR,Chilled Water ,371,"Celeste, Richard F, Laboratory of Chemistry",110310.0,1986-07-01,40.0027,-83.01177,Main,ACA,Lab,69,69,69
OSU_RTS.MDBUS_RT.371S_HF,CELESTE ST HEAT FLOW,KBTU/HR,Steam,371,"Celeste, Richard F, Laboratory of Chemistry",110310.0,1986-07-01,40.0027,-83.01177,Main,ACA,Lab,69,69,69
OSU_RTS.MDBUS_C1.372_HF,JAMES CW HEAT FLOW,KBTU/HR,Chilled Water ,372,Brain and Spine Hospital,258797.0,1990-05-01,,,Medical Center,,Patient Care,69,69,69
OSU_RTS.MDBUS_RT.372S_HF,JAMES STM HEAT FLOW,KBTU/HR,Steam,372,Brain and Spine Hospital,258797.0,1990-05-01,,,Medical Center,,Patient Care,69,69,69
OSU_RTS.MDBUS_RT.375S_HF,CCCT STM HEAT FLOW,KBTU/HR,Steam,375,The Ohio State University Comprehensive Cancer Center - Arthur G. James Ca*,1186252.0,1984-06-01,,,Medical Center,,Patient Care/Research,69,69,69
OSU_RTS.MDBUS_C1.375_HF,CCCT CW HEAT FLOW,KBTU/HR,Chilled Water ,375,The Ohio State University Comprehensive Cancer Center - Arthur G. James Ca*,1186252.0,1984-06-01,,,Medical Center,,Patient Care/Research,69,69,69
OSU_RTS.MDBUS_CC.376C_HF,ERCWP CW HEAT FLOW,KBTU/HR,Chilled Water ,376,"Chilled Water Plant, East Regional",34246.0,2014-04-01,,,Main,GEN,Facilities,,,
OSU_RTS.MDBUS_RT.376S_HF,ERCWP STM HEAT FLOW,KBTU/HR,Steam,376,"Chilled Water Plant, East Regional",34246.0,2014-04-01,,,Main,GEN,Facilities,,,
OSU_RTS.MDBUS_RT.038S_HF,HAMILTON STEAM HEAT FLOW,KBTU/HR,Steam,38,Hamilton Hall,141461.0,1925-06-01,,,Medical Center,ACA,Academic/Research,69,69,69
OSU_RTS.MDBUS_RT.386S_HF,WEXNER CNTR. ST HEAT FLO,KBTU/HR,Steam,386,Wexner Center for the Arts,131071.0,1989-07-01,40.00082,-83.00949,Main,ACA,Museum,69,69,69
OSU_RTS.MDBUS_CC.388C_HF,SCCCP CW HEAT FLOW,KBTU/HR,Chilled Water ,388,"Chiller Plant, South Campus Central",83056.0,2014-02-01,,,Main,GEN,Facilities,69,69,69
OSU_RTS.MDBUS_RT.390S_HF,WATER TRTMNT ST HEAT FLO,KBTU/HR,Steam,390,Water Treatment Building,19862.0,1986-07-01,,,Main,GEN,Facilities,,,
OSU_RTS.MDBUS_H1.004_HHF,209 HW HEAT FLOW,KBTU/HR,Heating Hot Water,4,"Eighteenth Ave, 209 W",25034.0,1993-07-01,40.00154,-83.01417,Main,ACA,Academic,69,69,69
OSU_RTS.MDBUS_C1.004_HF,209 W 18 CW HEAT FLOW,KBTU/HR,Chilled Water ,4,"Eighteenth Ave, 209 W",25034.0,1993-07-01,40.00154,-83.01417,Main,ACA,Academic,69,69,69
OSU_RTS.MDBUS_C1.041_HF,LAZENBY CW HEAT FLOW,KBTU/HR,Chilled Water ,41,Lazenby Hall,67323.0,1914-07-01,39.99858,-83.01571,Main,ACA,Academic,69,69,69
OSU_RTS.MDBUS_C1.046_HF,JOURNALISM CW HEAT FLOW,KBTU/HR,Chilled Water ,46,Journalism Building,84561.0,1974-07-01,40.002,-83.01504,Main,ACA,Academic,69,69,69
OSU_RTS.MDBUS_RT.049S_HF,DRINKO STM HEAT FLOW,KBTU/HR,Steam,49,"Drinko, John Deaver, Hall",211467.0,1956-07-01,39.99611,-83.00827,Main,ACA,Academic,69,69,69
OSU_RTS.MDBUS_C1.005_HF,SEL CW HEAT FLOW,KBTU/HR,Chilled Water ,5,Eighteenth Avenue Library,99181.0,1993-07-01,40.00163,-83.01334,Main,ACA,Library,69,69,69
OSU_RTS.MDBUS_RT.005S_HF,SEL STM HEAT FLOW,KBTU/HR,Steam,5,Eighteenth Avenue Library,99181.0,1993-07-01,40.00163,-83.01334,Main,ACA,Library,69,69,69
OSU_RTS.MDBUS_RT.050C_HF,THOMPSON CW HEAT FLOW,KBTU/HR,Chilled Water ,50,"Thompson, William Oxley, Memorial Library",300459.0,1912-07-01,39.99925,-83.01488,Main,ACA,Library,69,69,69
OSU_RTS.MDBUS_C1.053_HF,MCPHERSON CW HEAT FLOW,KBTU/HR,Chilled Water ,53,McPherson Chemical Laboratory,117599.0,1929-07-01,40.00252,-83.01233,Main,ACA,Academic/Research,69,69,69
OSU_RTS.MDBUS_RT.053S_HF,MCPHERSON ST HEAT FLOW,KBTU/HR,Steam,53,McPherson Chemical Laboratory,117599.0,1929-07-01,40.00252,-83.01233,Main,ACA,Academic/Research,69,69,69
OSU_RTS.MDBUS_RT.054S_HF,MENDENAHALL ST HEAT FLOW,KBTU/HR,Steam,54,Mendenhall Laboratory,122567.0,1905-07-01,39.99839,-83.01115,Main,ACA,Academic/Administration,69,69,69
OSU_RTS.MDBUS_RT.055S_HF,MERSHON STM HEAT FLOW,KBTU/HR,Steam,55,Mershon Auditorium,120223.0,1957-07-01,40.00054,-83.00895,Main,ACA,Auditorium,,,
OSU_RTS.MDBUS_RT.059S_HF,FRY STM HEAT FLOW,KBTU/HR,Steam,59,"Fry, Glenn Ansel, Hall",75040.0,1951-07-01,39.99465,-83.01636,Main,ACA,Academic/Research,69,69,69
OSU_RTS.MDBUS_RT.026S_HF,CALDWELL STM HEAT FLOW,KBTU/HR,Steam,6,,,,,,,,,,,
OSU_RTS.MDBUS_H1.060_HHF,ORTON HALL HW HEAT FLOW,KBTU/HR,Heating Hot Water,60,Orton Hall,41022.0,1893-07-01,39.99833,-83.01193,Main,ACA,Academic/Administration,69,69,69
OSU_RTS.MDBUS_RT.061S_HF,PAGE STM HEAT FLOW,KBTU/HR,Steam,61,Page Hall,64665.0,1902-07-01,39.99916,-83.00964,Main,ACA,Academic,69,69,69
OSU_RTS.MDBUS_C1.065_HF,SMITH LAB CW HEAT FLOW,KBTU/HR,Chilled Water ,65,"Smith, Alpheus, Laboratory",218839.0,1950-07-01,40.00243,-83.01328,Main,ACA,Academic/Research,69,69,69
OSU_RTS.MDBUS_RT.065S_HF,SMITH LAB ST HEAT FLOW,KBTU/HR,Steam,65,"Smith, Alpheus, Laboratory",218839.0,1950-07-01,40.00243,-83.01328,Main,ACA,Academic/Research,69,69,69
OSU_RTS.MDBUS_RT.067S_HF,POMERENE HALL ST HT FLOW,KBTU/HR,Steam,67,Pomerene Hall,73603.0,1922-07-01,,,Main,ACA,Academic,69,69,69
OSU_RTS.MDBUS_C1.069_HF,MCCRACKEN CW HEAT FLOW,KBTU/HR,Chilled Water ,69,McCracken Power Plant,110142.0,1918-07-01,40.00115,-83.01665,Main,GEN,Facilities/Administration,,,
OSU_RTS.MDBUS_RT.069S1_HF,MCCRACKEN ST 1 HEAT FLOW,KBTU/HR,Steam,69,McCracken Power Plant,110142.0,1918-07-01,40.00115,-83.01665,Main,GEN,Facilities/Administration,,,
OSU_RTS.MDBUS_RT.069S2_HF,MCCRACKEN ST 2 HEAT FLOW,KBTU/HR,Steam,69,McCracken Power Plant,110142.0,1918-07-01,40.00115,-83.01665,Main,GEN,Facilities/Administration,,,
OSU_RTS.MDBUS_RT.069S3_HF,MCCRACKEN ST 3 HEAT FLOW,KBTU/HR,Steam,69,McCracken Power Plant,110142.0,1918-07-01,40.00115,-83.01665,Main,GEN,Facilities/Administration,,,
OSU_RTS.MDBUS_H1.007_HHF,MATH TWR HW HEAT FLOW,KBTU/HR,Heating Hot Water,7,Mathematics Tower,61621.0,1993-07-01,40.00151,-83.01443,Main,ACA,Academic,69,69,69
OSU_RTS.MDBUS_C1.007_HF,MATH TWR CW HEAT FLOW,KBTU/HR,Chilled Water ,7,Mathematics Tower,61621.0,1993-07-01,40.00151,-83.01443,Main,ACA,Academic,69,69,69
OSU_RTS.MDBUS_C1.070_HF,PRB CW HEAT FLOW,KBTU/HR,Chilled Water ,70,Physics Research Building,238732.0,2005-07-01,40.00335,-83.01425,Main,ACA,Academic/Research,69,69,69
